{
  "schema_version": "gfxgraph-benchmark-v1",
  "report_kind": "benchmark_gate_phase_report",
  "run_id": "main-python-baseline-rust-hip-cpp-20260616",
  "phase": "installed-baseline",
  "timestamp_utc": "2026-06-16T14:32:53Z",
  "report_date": "2026-06-16",
  "schema_path": "benchmarks/schemas/gfxgraph-benchmark-v1.schema.json",
  "repo": {
    "root": "/home/local/ai/projects/gfxGRAPH",
    "branch": "rust-hip-cpp",
    "commit": "fe14ca8017e25f29248aa9bcefdb811cbc0c1e5e",
    "tracked_dirty": true
  },
  "environment": {
    "os": "Linux FRACTAL 6.8.0-90-generic #91-Ubuntu SMP PREEMPT_DYNAMIC Tue Nov 18 14:14:30 UTC 2025 x86_64 x86_64 x86_64 GNU/Linux",
    "rocm_path": "/opt/rocm",
    "hipcc_version": "HIP version: 7.2.26015-fc0010cf6a\nAMD clang version 22.0.0git (https://github.com/RadeonOpenCompute/llvm-project roc-7.2.0 26014 7b800a19466229b8479a78de19143dc33c3ab9b5)\nTarget: x86_64-unknown-linux-gnu\nThread model: posix\nInstalledDir: /opt/rocm-7.2.0/lib/llvm/bin\nConfiguration file: /opt/rocm-7.2.0/lib/llvm/bin/clang++.cfg",
    "env": {
      "GFXGRAPH": null,
      "GFXGRAPH_VALIDATE": null,
      "GFXGRAPH_VRAM_CAP": null,
      "HIP_VISIBLE_DEVICES": null,
      "HSA_OVERRIDE_GFX_VERSION": "10.3.0",
      "ROCM_PATH": "/opt/rocm"
    }
  },
  "python": {
    "executable": "/home/local/ai/projects/gfxGRAPH/.venv/bin/python",
    "imports": [
      {
        "direct_url": {
          "archive_info": {},
          "url": "file:///home/local/ai/projects/gfxGRAPH/dist/gfxgraph-1.0.1-py3-none-any.whl"
        },
        "distribution": "gfxgraph",
        "distribution_location": "/home/local/ai/projects/gfxGRAPH/.venv/lib/python3.12/site-packages",
        "importable": true,
        "name": "gfxgraph",
        "origin": "/home/local/ai/projects/gfxGRAPH/.venv/lib/python3.12/site-packages/gfxgraph/__init__.py",
        "search_locations": [
          "/home/local/ai/projects/gfxGRAPH/.venv/lib/python3.12/site-packages/gfxgraph"
        ],
        "version": "1.0.1"
      },
      {
        "direct_url": {
          "archive_info": {},
          "url": "file:///home/local/ai/projects/gfxGRAPH/dist/gfxgraph-1.0.1-py3-none-any.whl"
        },
        "distribution": "gfxgraph",
        "distribution_location": "/home/local/ai/projects/gfxGRAPH/.venv/lib/python3.12/site-packages",
        "importable": true,
        "name": "hipgraph_bridge",
        "origin": "/home/local/ai/projects/gfxGRAPH/.venv/lib/python3.12/site-packages/hipgraph_bridge/__init__.py",
        "search_locations": [
          "/home/local/ai/projects/gfxGRAPH/.venv/lib/python3.12/site-packages/hipgraph_bridge"
        ],
        "version": "1.0.1"
      },
      {
        "direct_url": {
          "dir_info": {},
          "url": "file:///home/local/ai/projects/gfxGRAPH/native"
        },
        "distribution": "gfxgraph-native",
        "distribution_location": "/home/local/ai/projects/gfxGRAPH/.venv/lib/python3.12/site-packages",
        "importable": true,
        "name": "gfxgraph_native",
        "origin": "/home/local/ai/projects/gfxGRAPH/.venv/lib/python3.12/site-packages/gfxgraph_native/__init__.py",
        "search_locations": [
          "/home/local/ai/projects/gfxGRAPH/.venv/lib/python3.12/site-packages/gfxgraph_native"
        ],
        "version": "0.3.3"
      },
      {
        "distribution": "rs-gfxgraph",
        "importable": false,
        "name": "rs_gfxgraph",
        "origin": null,
        "search_locations": null,
        "version_error": "PackageNotFoundError('rs-gfxgraph')"
      },
      {
        "distribution": "rs-gfxgraph-stats",
        "importable": false,
        "name": "rs_gfxgraph_stats",
        "origin": null,
        "search_locations": null,
        "version_error": "PackageNotFoundError('rs-gfxgraph-stats')"
      }
    ],
    "prefix": "/home/local/ai/projects/gfxGRAPH/.venv",
    "version": "3.12.7 (main, Oct 16 2024, 04:37:19) [Clang 18.1.8 ]"
  },
  "package_state": {
    "target_import_policy": "site-packages",
    "graph_enabled": false,
    "allow_package_changes": true,
    "package_actions": []
  },
  "gate_checks": [
    {
      "name": "python-import-isolation",
      "status": "passed",
      "message": "installed-baseline imports match site-packages policy",
      "details": {
        "checked": [
          {
            "importable": true,
            "in_repo": false,
            "module": "gfxgraph",
            "origin": "/home/local/ai/projects/gfxGRAPH/.venv/lib/python3.12/site-packages/gfxgraph/__init__.py"
          },
          {
            "importable": true,
            "in_repo": false,
            "module": "hipgraph_bridge",
            "origin": "/home/local/ai/projects/gfxGRAPH/.venv/lib/python3.12/site-packages/hipgraph_bridge/__init__.py"
          },
          {
            "importable": true,
            "in_repo": false,
            "module": "gfxgraph_native",
            "origin": "/home/local/ai/projects/gfxGRAPH/.venv/lib/python3.12/site-packages/gfxgraph_native/__init__.py"
          }
        ]
      }
    }
  ],
  "benchmarks": [
    {
      "name": "python-import-provenance",
      "kind": "package-provenance",
      "status": "passed",
      "command": "/home/local/ai/projects/gfxGRAPH/.venv/bin/python -c <probe>",
      "iterations": null,
      "duration_ms": 68.106157,
      "throughput_ops_per_sec": null,
      "stdout_tail": "{\"executable\": \"/home/local/ai/projects/gfxGRAPH/.venv/bin/python\", \"imports\": [{\"direct_url\": {\"archive_info\": {}, \"url\": \"file:///home/local/ai/projects/gfxGRAPH/dist/gfxgraph-1.0.1-py3-none-any.whl\"}, \"distribution\": \"gfxgraph\", \"distribution_location\": \"/home/local/ai/projects/gfxGRAPH/.venv/lib/python3.12/site-packages\", \"importable\": true, \"name\": \"gfxgraph\", \"origin\": \"/home/local/ai/projects/gfxGRAPH/.venv/lib/python3.12/site-packages/gfxgraph/__init__.py\", \"search_locations\": [\"/home/local/ai/projects/gfxGRAPH/.venv/lib/python3.12/site-packages/gfxgraph\"], \"version\": \"1.0.1\"}, {\"direct_url\": {\"archive_info\": {}, \"url\": \"file:///home/local/ai/projects/gfxGRAPH/dist/gfxgraph-1.0.1-py3-none-any.whl\"}, \"distribution\": \"gfxgraph\", \"distribution_location\": \"/home/local/ai/projects/gfxGRAPH/.venv/lib/python3.12/site-packages\", \"importable\": true, \"name\": \"hipgraph_bridge\", \"origin\": \"/home/local/ai/projects/gfxGRAPH/.venv/lib/python3.12/site-packages/hipgraph_bridge/__init__.py\", \"search_locations\": [\"/home/local/ai/projects/gfxGRAPH/.venv/lib/python3.12/site-packages/hipgraph_bridge\"], \"version\": \"1.0.1\"}, {\"direct_url\": {\"dir_info\": {}, \"url\": \"file:///home/local/ai/projects/gfxGRAPH/native\"}, \"distribution\": \"gfxgraph-native\", \"distribution_location\": \"/home/local/ai/projects/gfxGRAPH/.venv/lib/python3.12/site-packages\", \"importable\": true, \"name\": \"gfxgraph_native\", \"origin\": \"/home/local/ai/projects/gfxGRAPH/.venv/lib/python3.12/site-packages/gfxgraph_native/__init__.py\", \"search_locations\": [\"/home/local/ai/projects/gfxGRAPH/.venv/lib/python3.12/site-packages/gfxgraph_native\"], \"version\": \"0.3.3\"}, {\"distribution\": \"rs-gfxgraph\", \"importable\": false, \"name\": \"rs_gfxgraph\", \"origin\": null, \"search_locations\": null, \"version_error\": \"PackageNotFoundError('rs-gfxgraph')\"}, {\"distribution\": \"rs-gfxgraph-stats\", \"importable\": false, \"name\": \"rs_gfxgraph_stats\", \"origin\": null, \"search_locations\": null, \"version_error\": \"PackageNotFoundError('rs-gfxgraph-stats')\"}], \"prefix\": \"/home/local/ai/projects/gfxGRAPH/.venv\", \"version\": \"3.12.7 (main, Oct 16 2024, 04:37:19) [Clang 18.1.8 ]\"}\n",
      "stderr_tail": "",
      "metrics": {}
    },
    {
      "name": "torch-capture-policy",
      "kind": "capture-policy",
      "status": "passed",
      "command": "/home/local/ai/projects/gfxGRAPH/.venv/bin/python -c <capture-policy-probe>",
      "iterations": null,
      "duration_ms": 21640.553087,
      "throughput_ops_per_sec": null,
      "stdout_tail": "{\"GFXGRAPH_ENABLE_UNSAFE_TORCH_GRAPH_CAPTURE\": null, \"cuda_available\": true, \"cuda_execution_error\": \"CUDA execution probe passed\", \"cuda_execution_usable\": true, \"device\": \"AMD Radeon RX 6700 XT\", \"torch\": \"2.13.0a0+git53bbebe\", \"torch_graph_capture_block_reason\": \"high-level torch.cuda.graph capture is disabled by default on ROCm/HIP 7.2.26015; set GFXGRAPH_ENABLE_UNSAFE_TORCH_GRAPH_CAPTURE=1 to opt in\", \"torch_hip\": \"7.2.26015\", \"unsafe_torch_graph_capture_enabled\": false}\n",
      "stderr_tail": "",
      "metrics": {
        "probe": {
          "GFXGRAPH_ENABLE_UNSAFE_TORCH_GRAPH_CAPTURE": null,
          "cuda_available": true,
          "cuda_execution_error": "CUDA execution probe passed",
          "cuda_execution_usable": true,
          "device": "AMD Radeon RX 6700 XT",
          "torch": "2.13.0a0+git53bbebe",
          "torch_graph_capture_block_reason": "high-level torch.cuda.graph capture is disabled by default on ROCm/HIP 7.2.26015; set GFXGRAPH_ENABLE_UNSAFE_TORCH_GRAPH_CAPTURE=1 to opt in",
          "torch_hip": "7.2.26015",
          "unsafe_torch_graph_capture_enabled": false
        }
      }
    },
    {
      "name": "rust-bucket-router-core",
      "kind": "rust-micro",
      "status": "passed",
      "command": "in-process BucketRouterCore::route loop",
      "iterations": 200000,
      "duration_ms": 56.899409,
      "throughput_ops_per_sec": 3514974.9973677234,
      "stdout_tail": "",
      "stderr_tail": "",
      "metrics": {
        "bucket_count": 10,
        "ready_routes": 200000
      }
    },
    {
      "name": "rust-stats-sample-update",
      "kind": "rust-micro",
      "status": "passed",
      "command": "in-process GfxGraphStatsSample update loop",
      "iterations": 200000,
      "duration_ms": 1.3558109999999999,
      "throughput_ops_per_sec": 147513185.83489883,
      "stdout_tail": "",
      "stderr_tail": "",
      "metrics": {